{
  "schema_version": "1.0",
  "query": {
    "sku": "9999999",
    "mpn": null,
    "gtin": null,
    "manufacturer": null,
    "catalog_id": null,
    "normalized_key": "9999999|||"
  },
  "outcome": "not_found",
  "provider_mode": "recorded",
  "synthetic": false,
  "generated_at": "2026-10-24T18:49:08Z",
  "offers": [],
  "possible_matches": [],
  "alternatives": [],
  "ledger": [
    {
      "source": "adafruit",
      "url": "https://www.adafruit.com/product/9999999",
      "status": "not_found",
      "reason": "HTTP 404",
      "checked_at": "2026-10-24T18:49:08Z"
    },
    {
      "source": "sparkfun",
      "url": "https://www.sparkfun.com/products/99999999",
      "status": "not_found",
      "reason": "HTTP 404",
      "checked_at": "2026-10-24T18:49:23Z"
    },
    {
      "source": "mouser-api",
      "url": null,
      "status": "needs_api_key",
      "reason": "MOUSER_API_KEY not set",
      "checked_at": null
    },
    {
      "source": "digikey-api",
      "url": null,
      "status": "needs_api_key",
      "reason": "DIGIKEY_CLIENT_ID not set",
      "checked_at": null
    },
    {
      "source": "brave-search",
      "url": null,
      "status": "skipped",
      "reason": "recorded mode: no web search",
      "checked_at": null
    }
  ],
  "notices": [
    "No vendor page quoting this SKU was found. No link is shown because none was verified."
  ]
}
