{
  "schema_version": "1.0",
  "query": {
    "sku": "3801",
    "mpn": null,
    "gtin": null,
    "manufacturer": "Adafruit",
    "catalog_id": "motor.adafruit_tt_bimetal_1to90_3801",
    "normalized_key": "3801|||adafruit"
  },
  "outcome": "found",
  "provider_mode": "recorded",
  "synthetic": false,
  "generated_at": "2026-10-24T18:48:55Z",
  "offers": [
    {
      "offer_id": "adafruit:1e23de30a1c22803",
      "sku": "3801",
      "mpn": null,
      "gtin": null,
      "vendor": {
        "id": "adafruit",
        "name": "Adafruit Industries",
        "tier": "manufacturer",
        "domain": "adafruit.com"
      },
      "url": "https://www.adafruit.com/product/3801",
      "price_amount": "4.50",
      "currency": "USD",
      "availability": "in_stock",
      "min_order_qty": 1,
      "pack": {
        "quantity": 1,
        "unit_price_basis": "per_unit"
      },
      "shipping": null,
      "rating": null,
      "match": {
        "kind": "exact_sku",
        "confidence": 1.0,
        "evidence_quote": "\"sku\":3801"
      },
      "fetched_at": "2026-10-24T18:48:55Z",
      "evidence_level": "verified",
      "link_status": "pass",
      "reliability": {
        "score": 0.95,
        "factors": [
          {
            "key": "vendor_tier",
            "weight": 0.3,
            "value": 1.0,
            "note": ""
          },
          {
            "key": "match_exactness",
            "weight": 0.25,
            "value": 1.0,
            "note": ""
          },
          {
            "key": "freshness",
            "weight": 0.15,
            "value": 1.0,
            "note": ""
          },
          {
            "key": "link_status",
            "weight": 0.15,
            "value": 1.0,
            "note": ""
          },
          {
            "key": "rating",
            "weight": 0.05,
            "value": 0.0,
            "note": "no aggregateRating on page"
          },
          {
            "key": "price_outlier",
            "weight": 0.1,
            "value": 1.0,
            "note": ""
          }
        ]
      },
      "status": "ok",
      "source_sha256": "beaa0f8e09baccd9684c82b36396ca41c81543909682fafc52bcc42c1ca594a3"
    }
  ],
  "possible_matches": [],
  "alternatives": [],
  "ledger": [
    {
      "source": "adafruit",
      "url": "https://www.adafruit.com/product/3801",
      "status": "offer",
      "reason": "JSON-LD Product sku 3801, Offer price 4.5000 USD InStock",
      "checked_at": "2026-10-24T18:48:55Z"
    },
    {
      "source": "mouser-api",
      "url": null,
      "status": "needs_api_key",
      "reason": "MOUSER_API_KEY not set",
      "checked_at": null
    },
    {
      "source": "digikey-api",
      "url": null,
      "status": "needs_api_key",
      "reason": "DIGIKEY_CLIENT_ID not set",
      "checked_at": null
    },
    {
      "source": "brave-search",
      "url": null,
      "status": "skipped",
      "reason": "recorded mode: no web search",
      "checked_at": null
    }
  ],
  "notices": [
    "Prices and stock are as of the check time and may have changed. Rivet does not sell parts."
  ]
}
