{
  "schema_version": "1.0",
  "query": {
    "sku": "ROB-13301",
    "mpn": null,
    "gtin": null,
    "manufacturer": "SparkFun",
    "catalog_id": "chassis.sparkfun_shadow_rob13301",
    "normalized_key": "rob-13301|||sparkfun"
  },
  "outcome": "found",
  "provider_mode": "recorded",
  "synthetic": false,
  "generated_at": "2026-10-24T18:49:19Z",
  "offers": [
    {
      "offer_id": "sparkfun:6393a5ed7848e5b9",
      "sku": "ROB-13301",
      "mpn": "ROB-13301",
      "gtin": null,
      "vendor": {
        "id": "sparkfun",
        "name": "SparkFun Electronics",
        "tier": "manufacturer",
        "domain": "sparkfun.com"
      },
      "url": "https://www.sparkfun.com/products/13301",
      "price_amount": "14.95",
      "currency": "USD",
      "availability": "unknown",
      "min_order_qty": 1,
      "pack": {
        "quantity": 1,
        "unit_price_basis": "per_unit"
      },
      "shipping": null,
      "rating": null,
      "match": {
        "kind": "exact_sku",
        "confidence": 1.0,
        "evidence_quote": "\"sku\":\"ROB-13301\""
      },
      "fetched_at": "2026-10-24T18:49:19Z",
      "evidence_level": "verified",
      "link_status": "pass",
      "reliability": {
        "score": 0.95,
        "factors": [
          {
            "key": "vendor_tier",
            "weight": 0.3,
            "value": 1.0,
            "note": ""
          },
          {
            "key": "match_exactness",
            "weight": 0.25,
            "value": 1.0,
            "note": ""
          },
          {
            "key": "freshness",
            "weight": 0.15,
            "value": 1.0,
            "note": ""
          },
          {
            "key": "link_status",
            "weight": 0.15,
            "value": 1.0,
            "note": ""
          },
          {
            "key": "rating",
            "weight": 0.05,
            "value": 0.0,
            "note": "no aggregateRating on page"
          },
          {
            "key": "price_outlier",
            "weight": 0.1,
            "value": 1.0,
            "note": ""
          }
        ]
      },
      "status": "ok",
      "source_sha256": "ba83517a5cbcbede9a69d21f693b9e2690f49fc9eb37752f89b61f65877a2830"
    }
  ],
  "possible_matches": [],
  "alternatives": [],
  "ledger": [
    {
      "source": "sparkfun",
      "url": "https://www.sparkfun.com/products/13301",
      "status": "offer",
      "reason": "JSON-LD Product sku ROB-13301, Offer price 14.95 USD; no availability field",
      "checked_at": "2026-10-24T18:49:19Z"
    },
    {
      "source": "mouser-api",
      "url": null,
      "status": "needs_api_key",
      "reason": "MOUSER_API_KEY not set",
      "checked_at": null
    },
    {
      "source": "digikey-api",
      "url": null,
      "status": "needs_api_key",
      "reason": "DIGIKEY_CLIENT_ID not set",
      "checked_at": null
    },
    {
      "source": "brave-search",
      "url": null,
      "status": "skipped",
      "reason": "recorded mode: no web search",
      "checked_at": null
    }
  ],
  "notices": [
    "Stock status was not stated on the vendor page.",
    "Prices are as of the check time and may have changed. Rivet does not sell parts."
  ]
}
